[
  {"opportunity_id":"2990","decision":"PORTFOLIO","required_fields":["Name","Email","Resume","Portfolio"],"blockers":["Posting explicitly requires a strong portfolio","Application includes a Portfolio field"],"verified_at":"2026-09-02T05:47:29Z"},
  {"opportunity_id":"2994","decision":"ESSAY","required_fields":["First Name","Last Name","Email","Resume/CV","LinkedIn profile URL","Three substantive AI-system responses","Location and right-to-work","Availability"],"blockers":["Three substantive written essay responses required","Optional Cover Letter upload is present"],"verified_at":"2026-09-02T05:47:29Z"},
  {"opportunity_id":"3000","decision":"ESSAY","required_fields":["Full name","Email","Cover letter minimum 50 characters","CV","Citizenship","Residence permit","Italian professional tax ID","Privacy acknowledgement","reCAPTCHA"],"blockers":["Cover-letter essay required","reCAPTCHA required","Italian professional tax ID answer unknown"],"verified_at":"2026-09-02T05:47:51Z"},
  {"opportunity_id":"3001","decision":"ESSAY","required_fields":["First name","Last name","Email","Expected salary","Talent pool consent","CV","Cover letter"],"blockers":["CV and cover letter required","Degree eligibility uncertain"],"verified_at":"2026-09-02T05:47:51Z"},
  {"opportunity_id":"3002","decision":"ESSAY","required_fields":["First name","Last name","Email","Available from","Expected salary","CV","Brief cover letter"],"blockers":["Application instructions request a brief cover letter"],"verified_at":"2026-09-02T05:48:00Z"},
  {"opportunity_id":"3003","decision":"LOCATION","required_fields":["First name","Last name","Email","Available from","Expected salary","Location","Relocation to Munich","CV"],"blockers":["Munich office attendance at least four days weekly","Relocation willingness is not established","Application instructions request a brief cover letter"],"verified_at":"2026-09-02T05:48:00Z"},
  {"opportunity_id":"3004","decision":"ESSAY","required_fields":["First name","Last name","Email","Phone","Available from","Expected salary","Motivation essay","Office-days response","CV","Employment reference","Cover letter"],"blockers":["Motivation essay required","Cover letter and employment reference required","Munich office attendance at least three days weekly"],"verified_at":"2026-09-02T05:48:00Z"}
]
