[
  {"opportunity_id":"2976","decision":"ESSAY","required_fields":["First name","Last name","Phone","Email","Resume/CV","Do you live in Italy?","Where are you currently located?","When are you available to start working with us?","What is your current proficiency in English?","Do you have a degree in Computer Science (or a related field)? If so, when did you obtain it?","Had you heard about ShippyPro before applying?","Tell us about a project (personal, academic or professional) where you had to think carefully about how to structure your data. What did you decide and why?","Have you ever used AI tools as part of a development workflow? How, and what did you actually get out of it?","What's the last piece of code you wrote that you weren't happy with? What would you do differently?","What's something technical you taught yourself recently – not for school or work, just because you were curious?","Do you have a GitHub profile or personal website? If so, please share the link(s)","What are your must-haves and nice-to-haves in a company? (3 bullet points each are totally fine)","Privacy Policy acknowledgement"],"blockers":["The live application requires six substantive written-response fields beyond CV/basic-form information."],"verified_at":"2026-09-01T23:34:23Z"},
  {"opportunity_id":"2978","decision":"EXPERIENCE","required_fields":["Name","Email","Resume/CV","Which world region best describes your location?","Where exactly are you currently located?","Do you intend to relocate for this role?","Residence / visa / immigration status in the intended work location","Do you have professional experience in the maritime sector?","Expected annual base salary (€)","Notice period or available start date","Privacy Policy acknowledgement"],"blockers":["The posting requires 2–4 years in a customer support, customer success, or technical support role; the supplied profile documents approximately three years in development, QA, and automation instead.","The live Ashby application also loads a reCAPTCHA control."],"verified_at":"2026-09-01T23:34:23Z"},
  {"opportunity_id":"2979","decision":"DEAD","required_fields":[],"blockers":["The direct Ashby URL currently displays ‘Job not found’ and no application form."],"verified_at":"2026-09-01T23:34:23Z"},
  {"opportunity_id":"2980","decision":"DEAD","required_fields":[],"blockers":["The direct Ashby URL currently displays ‘Job not found’ and no application form."],"verified_at":"2026-09-01T23:34:23Z"},
  {"opportunity_id":"2981","decision":"ESSAY","required_fields":["First Name","Last Name","Email","Resume/CV","Why are you interested in Dwelly and this IT Support Engineer role?","Which tools / systems have you worked with?","Which security basics have you handled directly?","Are you comfortable working in a startup environment where processes may not be fully defined yet?","What is your current location and right to work status?","What is your notice period / availability to start?"],"blockers":["The live application requires a substantive role-specific motivation response beyond CV/basic-form information."],"verified_at":"2026-09-01T23:34:23Z"}
]
